{
  "spec_version": 1,
  "workflow_name": "broker_shadow_fixture",
  "driver": {
    "driver_id": "test.v1",
    "mode": "shadow",
    "decision_as_of": "2026-05-08T13:00:00.000Z",
    "allow_external_write": false,
    "allow_broker_resource": false
  },
  "layers": [
    {
      "layer": "job",
      "parent": null,
      "key_fields": ["workflow_name"]
    }
  ],
  "resources": [],
  "nodes": [
    {
      "node_id": "send",
      "algorithm": "cmd.send.mock.v1",
      "cell": {
        "layer": "job",
        "key": {
          "workflow_name": "broker_shadow_fixture"
        }
      },
      "config": {
        "max_reconciliation_age_s": 3600
      },
      "inputs": [],
      "outputs": [
        {
          "role": "broker_events",
          "product_type": "broker_event_set.v1"
        }
      ]
    }
  ]
}
